{
  "schema_version": "1.0.0",
  "doc_id": "MAN-000017",
  "source_sha256": "d63015fd98c051bc2b8d5f1f43d3b73759eea15732498c0b823a3da21c4b03c0",
  "model_fingerprint": "f1c34c90254d02b7eb93f443ca61de11c97ebb3a238ed9ce16748295d007713c",
  "prompt_version": "enrichment-v1",
  "summary": {
    "text": "본 매뉴얼은 정보자산 대장의 등록 항목과 변경 시 준수 사항 및 정기 검토 절차를 규정한다. 정보자산의 체계적인 관리를 위해 등록 항목과 변경 이력 관리 및 분기별 검토 기준을 제시한다.",
    "evidence": [
      {
        "section_id": "sec-ed97eba813",
        "quote": "자산명, 유형, 소유자, 운영자, 위치, 정보등급, 연계 시스템, 백업 여부 및 폐기 예정일을 등록한다."
      }
    ]
  },
  "key_points": [
    {
      "text": "정보자산 등록 시 자산명, 유형, 소유자, 운영자, 위치, 정보등급, 연계 시스템, 백업 여부 및 폐기 예정일을 포함해야 한다.",
      "evidence": [
        {
          "section_id": "sec-ed97eba813",
          "quote": "자산명, 유형, 소유자, 운영자, 위치, 정보등급, 연계 시스템, 백업 여부 및 폐기 예정일을 등록한다."
        }
      ]
    },
    {
      "text": "자산 정보 변경 시 기존 값을 덮어쓰지 않고 변경 근거와 적용일을 기록해야 한다.",
      "evidence": [
        {
          "section_id": "sec-7e85883302",
          "quote": "기존 값을 흔적 없이 덮어쓰지 않는다."
        }
      ]
    },
    {
      "text": "분기별로 미사용 자산, 소유자가 없는 자산 및 지원이 종료된 자산을 확인하는 정기 검토를 수행한다.",
      "evidence": [
        {
          "section_id": "sec-912677f88b",
          "quote": "분기별로 미사용 자산, 소유자가 없는 자산 및 지원이 종료된 자산을 확인한다."
        }
      ]
    }
  ],
  "keywords": [
    "정보자산",
    "자산대장",
    "정보등급",
    "미사용 자산",
    "지원이 종료된 자산",
    "정보자산 등록절차",
    "자산대장 매뉴얼"
  ],
  "entities": [
    {
      "name": "정보자산 분류 규정",
      "type": "document",
      "evidence": [
        {
          "section_id": "sec-912677f88b",
          "quote": "정보자산 분류 규정"
        }
      ]
    }
  ],
  "faq": [
    {
      "question": "정보자산의 정보등급은 어떻게 결정합니까?",
      "answer": "정보자산 분류 규정에 따라 결정합니다.",
      "evidence": [
        {
          "section_id": "sec-912677f88b",
          "quote": "정보등급은 [정보자산 분류 규정](REG-000004.md)에 따라 결정한다."
        }
      ]
    },
    {
      "question": "자산 정보 변경 시 어떤 항목을 남겨야 합니까?",
      "answer": "변경 근거와 적용일을 남겨야 합니다.",
      "evidence": [
        {
          "section_id": "sec-7e85883302",
          "quote": "소유자, 위치, 용도 또는 정보등급이 변경되면 변경 근거와 적용일을 남긴다."
        }
      ]
    }
  ],
  "relations": [
    {
      "to_doc_id": "REG-000004",
      "relation_type": "references",
      "evidence": [
        {
          "section_id": "sec-912677f88b",
          "quote": "정보등급은 [정보자산 분류 규정](REG-000004.md)에 따라 결정한다."
        }
      ]
    }
  ]
}
