{
  "schema_version": "1.0.0",
  "doc_id": "REG-000010",
  "source_sha256": "7fba733c9725b9cea6b55a66073dfc567421cafb478fb112b6f8354813e44066",
  "model_fingerprint": "f1c34c90254d02b7eb93f443ca61de11c97ebb3a238ed9ce16748295d007713c",
  "prompt_version": "enrichment-v1",
  "summary": {
    "text": "본 규정은 데이터 백업 및 복구에 관한 계획 수립과 기본 기준을 정의한다. 시스템 책임자는 중요도에 따라 백업 주기와 복구 시험을 수행해야 하며, 정기적인 복구 검증을 통해 데이터의 가용성을 보장해야 한다.",
    "evidence": [
      {
        "section_id": "sec-7973cedee1",
        "quote": "시스템 책임자는 업무 영향도와 복구 목표를 고려하여 백업 대상, 주기, 보관기간 및 보관 위치를 정한다."
      }
    ]
  },
  "key_points": [
    {
      "text": "시스템 책임자는 업무 영향도와 복구 목표를 기반으로 백업 계획을 수립해야 한다.",
      "evidence": [
        {
          "section_id": "sec-7973cedee1",
          "quote": "시스템 책임자는 업무 영향도와 복구 목표를 고려하여 백업 대상, 주기, 보관기간 및 보관 위치를 정한다."
        }
      ]
    },
    {
      "text": "데이터 중요도에 따라 백업 주기와 복구 시험 빈도를 차등 적용한다.",
      "evidence": [
        {
          "section_id": "sec-d0c40baff2",
          "quote": "상 | 매일 | 분기 1회 이상"
        }
      ]
    },
    {
      "text": "백업 성공 여부는 실제 복구 시험을 통해 검증해야 하며, 시험 데이터에 개인정보를 포함해서는 안 된다.",
      "evidence": [
        {
          "section_id": "sec-95ddedbdd9",
          "quote": "정기적으로 실제 복구 시험을 수행하고 결과와 개선사항을 기록한다."
        }
      ]
    }
  ],
  "keywords": [
    "데이터 백업",
    "복구 규정",
    "백업 계획",
    "복구 시험",
    "시스템 책임자",
    "복구 검증"
  ],
  "entities": [
    {
      "name": "시스템 책임자",
      "type": "role",
      "evidence": [
        {
          "section_id": "sec-7973cedee1",
          "quote": "시스템 책임자는 업무 영향도와 복구 목표를 고려하여 백업 대상, 주기, 보관기간 및 보관 위치를 정한다."
        }
      ]
    }
  ],
  "faq": [
    {
      "question": "데이터 중요도가 '상'인 경우 복구 시험은 얼마나 자주 수행해야 합니까?",
      "answer": "중요도가 '상'인 데이터는 분기 1회 이상 복구 시험을 수행해야 합니다.",
      "evidence": [
        {
          "section_id": "sec-d0c40baff2",
          "quote": "상 | 매일 | 분기 1회 이상"
        }
      ]
    },
    {
      "question": "백업 성공 메시지만으로 정상 복구를 판단해도 됩니까?",
      "answer": "아니요, 백업 성공 메시지만으로 판단하지 않으며 정기적으로 실제 복구 시험을 수행해야 합니다.",
      "evidence": [
        {
          "section_id": "sec-95ddedbdd9",
          "quote": "백업 성공 메시지만으로 정상 복구를 판단하지 않는다."
        }
      ]
    }
  ],
  "relations": []
}
