{
  "schema_version": "1.0.0",
  "doc_id": "REG-000008",
  "source_sha256": "a3cddbb5c2b3bbedee1d5f5d8e425edd22b103d1706e0ae6c5ea4d0bc53bd7fe",
  "model_fingerprint": "f1c34c90254d02b7eb93f443ca61de11c97ebb3a238ed9ce16748295d007713c",
  "prompt_version": "enrichment-v1",
  "summary": {
    "text": "본 규정은 중요 시스템의 로그 수집 대상과 시간 동기화 기준을 정의하고, 로그의 원본성 보장 및 운영자와 검토자의 역할 분리 등 보관과 보호에 관한 사항을 규정한다. 또한 보안 로그 분석을 위한 절차적 근거를 마련하고 있다.",
    "evidence": [
      {
        "section_id": "sec-67b2078f5a",
        "quote": "중요 시스템은 로그인, 권한 변경, 중요정보 조회, 설정 변경 및 오류 기록을 수집해야 한다."
      },
      {
        "section_id": "sec-f56af939d4",
        "quote": "로그는 원본성을 확인할 수 있도록 보호하고 시스템 운영자와 로그 검토자의 역할을 분리한다."
      }
    ]
  },
  "key_points": [
    {
      "text": "중요 시스템은 로그인, 권한 변경, 중요정보 조회 등 주요 행위에 대한 로그를 수집해야 한다.",
      "evidence": [
        {
          "section_id": "sec-67b2078f5a",
          "quote": "중요 시스템은 로그인, 권한 변경, 중요정보 조회, 설정 변경 및 오류 기록을 수집해야 한다."
        }
      ]
    },
    {
      "text": "로그 생성 시스템은 승인된 기준 시간과 동기화해야 하며, 오차 발생 시 관리자에게 통보해야 한다.",
      "evidence": [
        {
          "section_id": "sec-48b59ab0b1",
          "quote": "로그를 생성하는 시스템은 승인된 기준 시간과 동기화한다. 시간 오차가 허용 범위를 초과하면 관리자에게 알린다."
        }
      ]
    },
    {
      "text": "로그의 원본성을 보호하고 시스템 운영자와 로그 검토자의 역할을 분리하여 운영해야 한다.",
      "evidence": [
        {
          "section_id": "sec-f56af939d4",
          "quote": "로그는 원본성을 확인할 수 있도록 보호하고 시스템 운영자와 로그 검토자의 역할을 분리한다."
        }
      ]
    }
  ],
  "keywords": [
    "로그 관리",
    "모니터링",
    "시간 동기화",
    "원본성",
    "보안 로그"
  ],
  "entities": [
    {
      "name": "시스템 운영자",
      "type": "role",
      "evidence": [
        {
          "section_id": "sec-f56af939d4",
          "quote": "시스템 운영자와 로그 검토자의 역할을 분리한다."
        }
      ]
    },
    {
      "name": "로그 검토자",
      "type": "role",
      "evidence": [
        {
          "section_id": "sec-f56af939d4",
          "quote": "시스템 운영자와 로그 검토자의 역할을 분리한다."
        }
      ]
    },
    {
      "name": "보안 로그 분석 매뉴얼",
      "type": "document",
      "evidence": [
        {
          "section_id": "sec-f56af939d4",
          "quote": "분석 절차는 [보안 로그 분석 매뉴얼](MAN-000005.md)을 따른다."
        }
      ]
    }
  ],
  "faq": [
    {
      "question": "로그 수집 대상은 무엇인가요?",
      "answer": "중요 시스템의 로그인, 권한 변경, 중요정보 조회, 설정 변경 및 오류 기록입니다.",
      "evidence": [
        {
          "section_id": "sec-67b2078f5a",
          "quote": "중요 시스템은 로그인, 권한 변경, 중요정보 조회, 설정 변경 및 오류 기록을 수집해야 한다."
        }
      ]
    },
    {
      "question": "로그 분석 절차는 어떤 문서를 따라야 하나요?",
      "answer": "보안 로그 분석 매뉴얼을 따라야 합니다.",
      "evidence": [
        {
          "section_id": "sec-f56af939d4",
          "quote": "분석 절차는 [보안 로그 분석 매뉴얼](MAN-000005.md)을 따른다."
        }
      ]
    }
  ],
  "relations": [
    {
      "to_doc_id": "MAN-000005",
      "relation_type": "references",
      "evidence": [
        {
          "section_id": "sec-f56af939d4",
          "quote": "분석 절차는 [보안 로그 분석 매뉴얼](MAN-000005.md)을 따른다."
        }
      ]
    }
  ]
}
