{
  "schema_version": "1.0.0",
  "doc_id": "MAN-000018",
  "source_sha256": "71c1d30253faeeea09666555dd16d1d3b26f4dabeb678999773e264f543fa9d0",
  "model_fingerprint": "f1c34c90254d02b7eb93f443ca61de11c97ebb3a238ed9ce16748295d007713c",
  "prompt_version": "enrichment-v1",
  "summary": {
    "text": "본 문서는 저장매체의 폐기 절차를 규정하는 매뉴얼이다. 폐기 요청부터 방법 선택, 완료 확인까지의 단계별 지침을 포함하고 있다.",
    "evidence": [
      {
        "section_id": "sec-c312fb9f28",
        "quote": "자산번호, 매체 종류, 저장된 정보등급, 폐기 사유 및 승인자를 기록한다."
      }
    ]
  },
  "key_points": [
    {
      "text": "폐기 요청 시 자산번호, 매체 종류, 정보등급, 사유, 승인자를 기록해야 한다.",
      "evidence": [
        {
          "section_id": "sec-c312fb9f28",
          "quote": "자산번호, 매체 종류, 저장된 정보등급, 폐기 사유 및 승인자를 기록한다."
        }
      ]
    },
    {
      "text": "매체 상태에 따라 재사용 디스크는 덮어쓰기/암호키 폐기를, 고장 난 디스크는 물리적 파쇄를 수행한다.",
      "evidence": [
        {
          "section_id": "sec-9614654cf9",
          "quote": "고장 난 디스크 | 물리적 파쇄 |"
        }
      ]
    },
    {
      "text": "폐기 완료 후 처리 일시, 수행자, 입회자, 방법, 증빙을 기록하고 자산대장을 업데이트한다.",
      "evidence": [
        {
          "section_id": "sec-f12e326d1e",
          "quote": "처리 일시, 수행자, 입회자, 사용한 방법 및 증빙을 기록하고 자산대장의 상태를 변경한다."
        }
      ]
    }
  ],
  "keywords": [
    "저장매체",
    "폐기",
    "디스크 폐기절차",
    "매체 파기매뉴얼",
    "자산대장",
    "물리적 파쇄",
    "보안 파쇄"
  ],
  "entities": [
    {
      "name": "자산대장",
      "type": "system",
      "evidence": [
        {
          "section_id": "sec-f12e326d1e",
          "quote": "자산대장의 상태를 변경한다."
        }
      ]
    }
  ],
  "faq": [
    {
      "question": "고장 난 디스크는 어떻게 폐기해야 합니까?",
      "answer": "고장 난 디스크는 물리적 파쇄 방식을 사용하여 폐기해야 합니다.",
      "evidence": [
        {
          "section_id": "sec-9614654cf9",
          "quote": "고장 난 디스크 | 물리적 파쇄 |"
        }
      ]
    },
    {
      "question": "폐기 완료 후 어떤 조치를 취해야 합니까?",
      "answer": "처리 일시, 수행자, 입회자, 사용한 방법 및 증빙을 기록하고 자산대장의 상태를 변경해야 합니다.",
      "evidence": [
        {
          "section_id": "sec-f12e326d1e",
          "quote": "처리 일시, 수행자, 입회자, 사용한 방법 및 증빙을 기록하고 자산대장의 상태를 변경한다."
        }
      ]
    }
  ],
  "relations": []
}
