{
  "schema_version": "1.0.0",
  "doc_id": "MAN-000012",
  "source_sha256": "7a02dfcc3427921636636087d3340587555615a55ea8df5a0dde05290a76be2b",
  "model_fingerprint": "f1c34c90254d02b7eb93f443ca61de11c97ebb3a238ed9ce16748295d007713c",
  "prompt_version": "enrichment-v1",
  "summary": {
    "text": "본 매뉴얼은 취약점 조치 대상 확정 방법과 조치 방안, 그리고 예외 신청 시 필요한 필수 항목을 규정한다. 취약점 조치 시 위험을 실질적으로 줄일 수 있는 방법을 선택해야 하며, 예외 신청 시에는 구체적인 사유와 보호조치 등을 명시해야 한다.",
    "evidence": [
      {
        "section_id": "sec-3626cd409e",
        "quote": "스캐너 결과만으로 조치 대상을 확정하지 않는다."
      },
      {
        "section_id": "sec-03a32f9694",
        "quote": "예외에는 다음 항목이 필요하다."
      }
    ]
  },
  "key_points": [
    {
      "text": "취약점 조치 대상은 스캐너 결과뿐만 아니라 자산, 실제 버전, 노출 경로 등을 종합적으로 고려하여 확정한다.",
      "evidence": [
        {
          "section_id": "sec-3626cd409e",
          "quote": "자산, 실제 버전, 노출 경로와 악용 가능성을 확인한다."
        }
      ]
    },
    {
      "text": "조치 방법은 패치, 설정 변경, 기능 제거, 접근 제한 중 위험을 실질적으로 줄일 수 있는 방안을 선택한다.",
      "evidence": [
        {
          "section_id": "sec-2f24ff3909",
          "quote": "패치, 설정 변경, 기능 제거 또는 접근 제한 중 위험을 실질적으로 줄일 수 있는 방법을 선택한다."
        }
      ]
    },
    {
      "text": "예외 신청 시 조치 불가 사유, 잔존 위험, 임시 보호조치, 책임자, 만료일, 재검토 일정을 포함해야 한다.",
      "evidence": [
        {
          "section_id": "sec-03a32f9694",
          "quote": "예외에는 다음 항목이 필요하다."
        }
      ]
    }
  ],
  "keywords": [
    "취약점 조치",
    "예외 신청",
    "임시 보호조치",
    "위험도",
    "보안패치",
    "자산",
    "노출 경로"
  ],
  "entities": [
    {
      "name": "취약점 및 보안패치 관리 규정",
      "type": "document",
      "evidence": [
        {
          "section_id": "sec-03a32f9694",
          "quote": "위험도별 기한은 [취약점 및 보안패치 관리 규정](REG-000014.md)을 따른다."
        }
      ]
    }
  ],
  "faq": [
    {
      "question": "취약점 조치 대상을 확정할 때 무엇을 확인해야 하나요?",
      "answer": "스캐너 결과 외에도 자산, 실제 버전, 노출 경로와 악용 가능성을 확인해야 합니다.",
      "evidence": [
        {
          "section_id": "sec-3626cd409e",
          "quote": "자산, 실제 버전, 노출 경로와 악용 가능성을 확인한다."
        }
      ]
    },
    {
      "question": "예외 신청 시 반드시 포함해야 할 항목은 무엇인가요?",
      "answer": "조치할 수 없는 구체적 사유, 남는 위험과 영향, 임시 보호조치, 책임자와 만료일, 재검토 일정이 필요합니다.",
      "evidence": [
        {
          "section_id": "sec-03a32f9694",
          "quote": "예외에는 다음 항목이 필요하다."
        }
      ]
    }
  ],
  "relations": [
    {
      "to_doc_id": "REG-000014",
      "relation_type": "based_on",
      "evidence": [
        {
          "section_id": "sec-03a32f9694",
          "quote": "위험도별 기한은 [취약점 및 보안패치 관리 규정](REG-000014.md)을 따른다."
        }
      ]
    }
  ]
}
