{
  "schema_version": "1.0.0",
  "doc_id": "REP-000008",
  "source_sha256": "542214281b94403181e8b9232f04caeec0101b03276b8a164005b0c1ce00e856",
  "model_fingerprint": "f1c34c90254d02b7eb93f443ca61de11c97ebb3a238ed9ce16748295d007713c",
  "prompt_version": "enrichment-v1",
  "summary": {
    "text": "2026년 상반기 재직자와 신규 입사자를 대상으로 실시한 정보보호 교육의 이수 현황을 보고한다. 교육 결과와 함께 미이수자에 대한 후속 조치 계획을 포함하고 있다.",
    "evidence": [
      {
        "section_id": "sec-6c9914d489",
        "quote": "2026년 상반기 재직자 615명과 신규 입사자 74명을 대상으로 기본 정보보호 교육을 운영했다."
      }
    ]
  },
  "key_points": [
    {
      "text": "2026년 상반기 재직자 615명과 신규 입사자 74명을 대상으로 기본 정보보호 교육을 운영함.",
      "evidence": [
        {
          "section_id": "sec-6c9914d489",
          "quote": "2026년 상반기 재직자 615명과 신규 입사자 74명을 대상으로 기본 정보보호 교육을 운영했다."
        }
      ]
    },
    {
      "text": "교육 이수율은 재직자 98.2%, 신규 입사자 100%를 기록함.",
      "evidence": [
        {
          "section_id": "sec-4c039a6d76",
          "quote": "재직자 | 615 | 604 | 98.2%"
        }
      ]
    },
    {
      "text": "미이수자 11명 중 휴직자 4명은 복귀 후 교육하며, 나머지 7명은 7월 보충교육 대상으로 등록함.",
      "evidence": [
        {
          "section_id": "sec-0df94feb4e",
          "quote": "미이수자 11명 중 휴직자 4명은 복귀 후 교육하고 나머지 7명은 7월 보충교육 대상으로 등록했다."
        }
      ]
    }
  ],
  "keywords": [
    "정보보호 교육",
    "이수현황",
    "재직자",
    "신규 입사자",
    "보충교육",
    "피싱 모의훈련",
    "보안교육"
  ],
  "entities": [],
  "faq": [
    {
      "question": "2026년 상반기 정보보호 교육 대상자는 누구인가요?",
      "answer": "재직자 615명과 신규 입사자 74명을 대상으로 교육을 운영했습니다.",
      "evidence": [
        {
          "section_id": "sec-6c9914d489",
          "quote": "2026년 상반기 재직자 615명과 신규 입사자 74명을 대상으로 기본 정보보호 교육을 운영했다."
        }
      ]
    },
    {
      "question": "교육 미이수자에 대한 후속 조치는 무엇인가요?",
      "answer": "휴직자 4명은 복귀 후 교육하고, 나머지 7명은 7월 보충교육 대상으로 등록했습니다.",
      "evidence": [
        {
          "section_id": "sec-0df94feb4e",
          "quote": "미이수자 11명 중 휴직자 4명은 복귀 후 교육하고 나머지 7명은 7월 보충교육 대상으로 등록했다."
        }
      ]
    }
  ],
  "relations": []
}
