{
  "schema_version": "1.0.0",
  "doc_id": "MAN-000008",
  "source_sha256": "6678820902189277454c1ea3ed162d0b98a9409da3f5609991c1b817c98a50c1",
  "model_fingerprint": "f1c34c90254d02b7eb93f443ca61de11c97ebb3a238ed9ce16748295d007713c",
  "prompt_version": "enrichment-v1",
  "summary": {
    "text": "본 문서는 암호키의 등록, 교체, 노출 의심 시 대응 절차를 규정하는 운영 매뉴얼이다. 암호키의 안전한 관리와 폐기 과정을 명시하고 있다.",
    "evidence": [
      {
        "section_id": "sec-f694756fdc",
        "quote": "키 소유자, 사용 목적, 대상 시스템, 생성일, 만료일 및 교체 담당자를 등록한다."
      }
    ]
  },
  "key_points": [
    {
      "text": "키 등록 시 키 원문을 작업 티켓이나 메신저에 기록하는 것을 금지한다.",
      "evidence": [
        {
          "section_id": "sec-f694756fdc",
          "quote": "키 원문을 작업 티켓이나 메신저에 기록하지 않는다."
        }
      ]
    },
    {
      "text": "키 교체는 새 키 생성, 비운영 환경 시험, 병행 기간 설정, 사용 여부 확인, 폐기 순으로 진행한다.",
      "evidence": [
        {
          "section_id": "sec-7809c59efb",
          "quote": "1. 새 키를 생성한다."
        }
      ]
    },
    {
      "text": "키 노출이 의심되는 경우 즉시 교체하고 사용 기록을 분석해야 한다.",
      "evidence": [
        {
          "section_id": "sec-f5360d6dc1",
          "quote": "노출 여부가 확정되지 않았더라도 관련 키를 교체하고 사용 기록을 분석한다."
        }
      ]
    }
  ],
  "keywords": [
    "암호키",
    "키수명주기",
    "키 등록",
    "노출 의심",
    "키관리 매뉴얼",
    "KMS 운영절차"
  ],
  "entities": [
    {
      "name": "암호화 및 암호키 관리 규정",
      "type": "document",
      "evidence": [
        {
          "section_id": "sec-f5360d6dc1",
          "quote": "판단 기준은 [암호화 및 암호키 관리 규정](REG-000013.md)을 따른다."
        }
      ]
    }
  ],
  "faq": [
    {
      "question": "키 노출이 의심될 때 어떤 조치를 취해야 하나요?",
      "answer": "노출 여부가 확정되지 않았더라도 관련 키를 즉시 교체하고 사용 기록을 분석해야 합니다.",
      "evidence": [
        {
          "section_id": "sec-f5360d6dc1",
          "quote": "노출 여부가 확정되지 않았더라도 관련 키를 교체하고 사용 기록을 분석한다."
        }
      ]
    },
    {
      "question": "키 교체 절차는 어떻게 되나요?",
      "answer": "새 키 생성, 비운영 환경 시험, 병행 기간 설정, 구 키 사용 여부 확인, 승인 후 구 키 폐기 순으로 진행합니다.",
      "evidence": [
        {
          "section_id": "sec-7809c59efb",
          "quote": "1. 새 키를 생성한다."
        }
      ]
    }
  ],
  "relations": [
    {
      "to_doc_id": "REG-000013",
      "relation_type": "based_on",
      "evidence": [
        {
          "section_id": "sec-f5360d6dc1",
          "quote": "노출 여부가 확정되지 않았더라도 관련 키를 교체하고 사용 기록을 분석한다. 판단 기준은 [암호화 및 암호키 관리 규정](REG-000013.md)을 따른다."
        }
      ]
    }
  ]
}
