{
  "schema_version": "1.0.0",
  "doc_id": "REG-000014",
  "source_sha256": "0a721349fc63a5aa942a05c26e3cf880f318915b7dec2fe27de3b88217c2ecc2",
  "model_fingerprint": "f1c34c90254d02b7eb93f443ca61de11c97ebb3a238ed9ce16748295d007713c",
  "prompt_version": "enrichment-v1",
  "summary": {
    "text": "본 규정은 시스템의 취약점을 식별하는 방법과 위험도에 따른 보안패치 조치 기한을 정의한다. 또한 기한 내 조치가 불가능한 경우에 대한 예외 관리 절차를 명시하고 있다.",
    "evidence": [
      {
        "section_id": "sec-851fcd8a3d",
        "quote": "시스템 책임자는 정기 점검, 공급업체 공지, 침해지표 및 외부 제보를 통해 취약점을 식별한다."
      },
      {
        "section_id": "sec-0ca027660a",
        "quote": "위험도 | 원칙적 조치기한"
      }
    ]
  },
  "key_points": [
    {
      "text": "취약점 식별은 정기 점검, 공급업체 공지, 침해지표, 외부 제보를 통해 수행한다.",
      "evidence": [
        {
          "section_id": "sec-851fcd8a3d",
          "quote": "시스템 책임자는 정기 점검, 공급업체 공지, 침해지표 및 외부 제보를 통해 취약점을 식별한다."
        }
      ]
    },
    {
      "text": "위험도에 따라 긴급은 72시간, 높음은 14일, 보통은 60일 이내에 조치해야 한다.",
      "evidence": [
        {
          "section_id": "sec-0ca027660a",
          "quote": "긴급 | 72시간 이내"
        }
      ]
    },
    {
      "text": "기한 내 조치가 어려운 경우 사유와 임시 보호조치 등을 포함한 예외 관리를 등록해야 한다.",
      "evidence": [
        {
          "section_id": "sec-06fcbaf354",
          "quote": "기한 내 조치할 수 없으면 사유, 영향, 임시 보호조치, 책임자 및 새로운 완료일을 등록한다."
        }
      ]
    }
  ],
  "keywords": [
    "취약점",
    "보안패치",
    "조치기한",
    "예외관리",
    "시스템 책임자",
    "위험도",
    "침해지표"
  ],
  "entities": [
    {
      "name": "시스템 책임자",
      "type": "role",
      "evidence": [
        {
          "section_id": "sec-851fcd8a3d",
          "quote": "시스템 책임자는 정기 점검, 공급업체 공지, 침해지표 및 외부 제보를 통해 취약점을 식별한다."
        }
      ]
    }
  ],
  "faq": [
    {
      "question": "긴급 위험도의 취약점은 언제까지 조치해야 합니까?",
      "answer": "긴급 위험도의 취약점은 72시간 이내에 조치해야 합니다.",
      "evidence": [
        {
          "section_id": "sec-0ca027660a",
          "quote": "긴급 | 72시간 이내"
        }
      ]
    },
    {
      "question": "보안패치 조치 기한을 지키지 못할 경우 어떻게 해야 합니까?",
      "answer": "사유, 영향, 임시 보호조치, 책임자 및 새로운 완료일을 등록하여 예외 관리를 수행해야 합니다.",
      "evidence": [
        {
          "section_id": "sec-06fcbaf354",
          "quote": "기한 내 조치할 수 없으면 사유, 영향, 임시 보호조치, 책임자 및 새로운 완료일을 등록한다."
        }
      ]
    }
  ],
  "relations": []
}
