{
  "schema_version": "1.0.0",
  "doc_id": "REG-000019",
  "source_sha256": "5e07f1aa92883e80e0b9aa45f9733c9cd871c6ba0399be69b701a7d8913df96f",
  "model_fingerprint": "f1c34c90254d02b7eb93f443ca61de11c97ebb3a238ed9ce16748295d007713c",
  "prompt_version": "enrichment-v1",
  "summary": {
    "text": "본 규정은 업무용 모바일기기의 보안 설정을 강화하고 애플리케이션 설치 및 기기 분실 시 대응 절차를 명시한다. 또한 기존의 구형 모바일기기 사용 규정을 대체하여 적용된다.",
    "evidence": [
      {
        "section_id": "sec-3610779dff",
        "quote": "업무용 모바일기기는 화면 잠금, 저장공간 암호화, 악성 앱 탐지 및 원격 초기화 기능을 활성화한다."
      },
      {
        "section_id": "sec-fe7e55c0c1",
        "quote": "이 규정은 [구형 모바일기기 사용 규정](REG-000018.md)을 대체한다."
      }
    ]
  },
  "key_points": [
    {
      "text": "업무용 모바일기기에 화면 잠금, 암호화, 악성 앱 탐지 등 필수 보안 기능을 활성화해야 한다.",
      "evidence": [
        {
          "section_id": "sec-3610779dff",
          "quote": "업무용 모바일기기는 화면 잠금, 저장공간 암호화, 악성 앱 탐지 및 원격 초기화 기능을 활성화한다."
        }
      ]
    },
    {
      "text": "업무정보 접근 앱은 승인된 경로로만 설치하며, 출처 불분명한 프로파일 및 인증서 설치를 금지한다.",
      "evidence": [
        {
          "section_id": "sec-7794e35d60",
          "quote": "업무정보에 접근하는 앱은 승인된 배포 경로를 통해 설치한다. 출처가 불분명한 프로파일과 인증서는 설치하지 않는다."
        }
      ]
    },
    {
      "text": "기기 분실 시 즉시 신고하고 원격 잠금 또는 삭제를 수행하며, 기기 반납 시 업무정보 제거 여부를 확인해야 한다.",
      "evidence": [
        {
          "section_id": "sec-fe7e55c0c1",
          "quote": "분실 시 즉시 신고하고 원격 잠금 또는 삭제를 수행한다. 기기를 교체하거나 반납할 때에는 업무정보가 제거되었는지 확인한다."
        }
      ]
    }
  ],
  "keywords": [
    "모바일기기",
    "화면 잠금",
    "저장공간 암호화",
    "악성 앱 탐지",
    "원격 초기화",
    "업무정보",
    "단말보안"
  ],
  "entities": [],
  "faq": [
    {
      "question": "업무용 모바일기기에서 반드시 활성화해야 하는 보안 기능은 무엇인가요?",
      "answer": "화면 잠금, 저장공간 암호화, 악성 앱 탐지 및 원격 초기화 기능을 활성화해야 합니다.",
      "evidence": [
        {
          "section_id": "sec-3610779dff",
          "quote": "업무용 모바일기기는 화면 잠금, 저장공간 암호화, 악성 앱 탐지 및 원격 초기화 기능을 활성화한다."
        }
      ]
    },
    {
      "question": "기기를 반납할 때 무엇을 확인해야 하나요?",
      "answer": "기기 내에 업무정보가 제거되었는지 확인해야 합니다.",
      "evidence": [
        {
          "section_id": "sec-fe7e55c0c1",
          "quote": "기기를 교체하거나 반납할 때에는 업무정보가 제거되었는지 확인한다."
        }
      ]
    }
  ],
  "relations": [
    {
      "to_doc_id": "REG-000018",
      "relation_type": "supersedes",
      "evidence": [
        {
          "section_id": "sec-fe7e55c0c1",
          "quote": "이 규정은 [구형 모바일기기 사용 규정](REG-000018.md)을 대체한다."
        }
      ]
    }
  ]
}
