{
  "schema_version": "1.0.0",
  "doc_id": "MAN-000013",
  "source_sha256": "d01d4584aeb6e80baaf2d7c50e0d9406fcb79a7e57441f4cd861819108348a02",
  "model_fingerprint": "f1c34c90254d02b7eb93f443ca61de11c97ebb3a238ed9ce16748295d007713c",
  "prompt_version": "enrichment-v1",
  "summary": {
    "text": "본 매뉴얼은 방문자의 사전 등록부터 방문 당일 출입 관리, 퇴실 절차까지의 전 과정을 규정한다. 방문자의 신분 확인, 방문증 착용, 구역 제한 및 퇴실 시 방문증 회수 절차를 포함한다.",
    "evidence": [
      {
        "section_id": "sec-0dca878e44",
        "quote": "피방문자는 방문 목적, 방문자 이름, 소속, 출입 예정시간 및 방문 구역을 등록한다."
      },
      {
        "section_id": "sec-1c2b8e37ad",
        "quote": "방문증을 회수하고 실제 퇴실 시각을 기록한다."
      }
    ]
  },
  "key_points": [
    {
      "text": "방문자는 방문 전 목적, 인적 사항, 방문 구역 등을 사전 등록해야 한다.",
      "evidence": [
        {
          "section_id": "sec-0dca878e44",
          "quote": "피방문자는 방문 목적, 방문자 이름, 소속, 출입 예정시간 및 방문 구역을 등록한다."
        }
      ]
    },
    {
      "text": "방문 당일에는 신분 확인 후 방문증을 착용하고 허용된 구역만 출입해야 한다.",
      "evidence": [
        {
          "section_id": "sec-a498c3b9c6",
          "quote": "신분을 확인한다."
        }
      ]
    },
    {
      "text": "퇴실 시 방문증을 회수하고 퇴실 시각을 기록하며, 미반납 시 즉시 비활성화한다.",
      "evidence": [
        {
          "section_id": "sec-1c2b8e37ad",
          "quote": "방문증을 회수하고 실제 퇴실 시각을 기록한다."
        }
      ]
    }
  ],
  "keywords": [
    "방문자",
    "출입관리",
    "사전 등록",
    "방문증",
    "퇴실",
    "물리적 보안구역 관리 규정"
  ],
  "entities": [
    {
      "name": "피방문자",
      "type": "role",
      "evidence": [
        {
          "section_id": "sec-0dca878e44",
          "quote": "피방문자는 방문 목적, 방문자 이름, 소속, 출입 예정시간 및 방문 구역을 등록한다."
        }
      ]
    },
    {
      "name": "방문증",
      "type": "asset",
      "evidence": [
        {
          "section_id": "sec-a498c3b9c6",
          "quote": "방문증을 눈에 보이게 착용하도록 안내한다."
        }
      ]
    }
  ],
  "faq": [
    {
      "question": "방문 당일 준수해야 할 사항은 무엇인가요?",
      "answer": "신분 확인을 거쳐야 하며, 방문증을 눈에 보이게 착용하고 허용된 구역만 출입해야 합니다. 촬영이나 장비 반입이 필요할 경우 별도 승인을 확인해야 합니다.",
      "evidence": [
        {
          "section_id": "sec-a498c3b9c6",
          "quote": "신분을 확인한다."
        }
      ]
    },
    {
      "question": "방문증을 반납하지 않고 퇴실한 경우 어떻게 처리하나요?",
      "answer": "미반납된 방문증은 즉시 비활성화 처리합니다.",
      "evidence": [
        {
          "section_id": "sec-1c2b8e37ad",
          "quote": "미반납 방문증은 즉시 비활성화한다."
        }
      ]
    }
  ],
  "relations": [
    {
      "to_doc_id": "REG-000015",
      "relation_type": "references",
      "evidence": [
        {
          "section_id": "sec-1c2b8e37ad",
          "quote": "관련 기준은 [물리적 보안구역 관리 규정](REG-000015.md)이다."
        }
      ]
    }
  ]
}
