{
  "schema_version": "1.0.0",
  "doc_id": "REP-000002",
  "source_sha256": "68569e9b176a83d5186ad107970f4464cf363ae6ff0fe8c6e7fa0f65949374eb",
  "model_fingerprint": "f1c34c90254d02b7eb93f443ca61de11c97ebb3a238ed9ce16748295d007713c",
  "prompt_version": "enrichment-v1",
  "summary": {
    "text": "본 보고서는 2026년 상반기 정보주체의 개인정보 요청 처리 현황과 내부 점검 결과를 정리한 문서이다. 또한 3분기에 수행할 담당자 교육 및 시스템 보유기간 대조 점검 계획을 포함하고 있다.",
    "evidence": [
      {
        "section_id": "sec-68e6cb0df0",
        "quote": "상반기에 총 26건을 접수했으며 유형별 건수는 다음과 같다."
      },
      {
        "section_id": "sec-e033ca5686",
        "quote": "처리 담당자 교육과 시스템별 보유기간 대조 점검을 3분기에 수행한다."
      }
    ]
  },
  "key_points": [
    {
      "text": "상반기 정보주체 요청은 총 26건으로 열람, 정정, 삭제, 처리정지 유형으로 구분된다.",
      "evidence": [
        {
          "section_id": "sec-68e6cb0df0",
          "quote": "상반기에 총 26건을 접수했으며 유형별 건수는 다음과 같다."
        }
      ]
    },
    {
      "text": "보유기간이 지난 시험 데이터 2건을 삭제하고 자동화 작업에 만료 알림을 추가하였다.",
      "evidence": [
        {
          "section_id": "sec-afa2c636f1",
          "quote": "보유기간이 지난 시험 데이터 2건을 발견하여 삭제했고, 관련 자동화 작업에 만료 알림을 추가했다."
        }
      ]
    },
    {
      "text": "3분기에는 개인정보 처리 규정을 기준으로 담당자 교육과 시스템별 보유기간 대조 점검을 수행한다.",
      "evidence": [
        {
          "section_id": "sec-e033ca5686",
          "quote": "처리 담당자 교육과 시스템별 보유기간 대조 점검을 3분기에 수행한다. 판단 기준은 [개인정보 처리 규정](REG-000003.md)이다."
        }
      ]
    }
  ],
  "keywords": [
    "개인정보",
    "반기보고",
    "정보주체",
    "열람",
    "정정",
    "삭제",
    "처리정지",
    "보유기간"
  ],
  "entities": [
    {
      "name": "개인정보 처리 규정",
      "type": "document",
      "evidence": [
        {
          "section_id": "sec-e033ca5686",
          "quote": "판단 기준은 [개인정보 처리 규정](REG-000003.md)이다."
        }
      ]
    }
  ],
  "faq": [
    {
      "question": "상반기 동안 접수된 정보주체의 요청은 총 몇 건인가요?",
      "answer": "상반기에 접수된 정보주체의 요청은 총 26건입니다.",
      "evidence": [
        {
          "section_id": "sec-68e6cb0df0",
          "quote": "상반기에 총 26건을 접수했으며 유형별 건수는 다음과 같다."
        }
      ]
    },
    {
      "question": "3분기 후속조치의 판단 기준은 무엇인가요?",
      "answer": "3분기 후속조치의 판단 기준은 개인정보 처리 규정입니다.",
      "evidence": [
        {
          "section_id": "sec-e033ca5686",
          "quote": "판단 기준은 [개인정보 처리 규정](REG-000003.md)이다."
        }
      ]
    }
  ],
  "relations": [
    {
      "to_doc_id": "REG-000003",
      "relation_type": "based_on",
      "evidence": [
        {
          "section_id": "sec-e033ca5686",
          "quote": "처리 담당자 교육과 시스템별 보유기간 대조 점검을 3분기에 수행한다. 판단 기준은 [개인정보 처리 규정](REG-000003.md)이다."
        }
      ]
    }
  ]
}
