{
  "schema_version": "1.0.0",
  "doc_id": "MAN-000006",
  "source_sha256": "7624af43e8ef90a1c960352445bf79fbb04c73554f8d537e5a5d695e83ac8254",
  "model_fingerprint": "f1c34c90254d02b7eb93f443ca61de11c97ebb3a238ed9ce16748295d007713c",
  "prompt_version": "enrichment-v1",
  "summary": {
    "text": "본 문서는 정보보호 사고 발생 시 최초 신고 접수부터 초기 대응, 그리고 사고 종료 절차까지의 표준 대응 지침을 다룬다. 사고 발생 시 증거 보존의 중요성과 체계적인 복구 및 재발 방지 대책 수립을 강조한다.",
    "evidence": [
      {
        "section_id": "sec-f0a4837a50",
        "quote": "신고 시각, 신고자, 대상 시스템, 관찰된 현상 및 이미 수행한 조치를 기록한다."
      },
      {
        "section_id": "sec-ed988a279c",
        "quote": "원인, 영향, 재발 방지대책 및 미해결 항목을 검토한다."
      }
    ]
  },
  "key_points": [
    {
      "text": "최초 신고 접수 시 신고자, 대상 시스템, 관찰 현상 등을 상세히 기록해야 한다.",
      "evidence": [
        {
          "section_id": "sec-f0a4837a50",
          "quote": "신고 시각, 신고자, 대상 시스템, 관찰된 현상 및 이미 수행한 조치를 기록한다."
        }
      ]
    },
    {
      "text": "초기 대응 단계에서 담당자 지정, 영향 범위 확인, 증거 보존, 확산 방지, 복구 우선순위 설정을 수행한다.",
      "evidence": [
        {
          "section_id": "sec-c64ff64ff1",
          "quote": "1. 담당자를 지정한다.\n2. 영향 범위를 확인한다.\n3. 필요한 로그와 메모리 등 증거를 보존한다.\n4. 확산 방지 조치를 수행한다.\n5. 복구 우선순위를 정한다."
        }
      ]
    },
    {
      "text": "증거 보존 전 시스템 재부팅은 휘발성 정보 손실을 초래할 수 있으므로 주의해야 한다.",
      "evidence": [
        {
          "section_id": "sec-c64ff64ff1",
          "quote": "증거 보존 전에 무조건 시스템을 재부팅하면 중요한 휘발성 정보가 사라질 수 있다."
        }
      ]
    },
    {
      "text": "사고 종료 시 서비스 복구뿐만 아니라 원인 분석 및 재발 방지대책 검토가 필수적이다.",
      "evidence": [
        {
          "section_id": "sec-ed988a279c",
          "quote": "서비스 복구만으로 사고를 종료하지 않는다. 원인, 영향, 재발 방지대책 및 미해결 항목을 검토한다."
        }
      ]
    }
  ],
  "keywords": [
    "정보보호 사고",
    "최초 신고 접수",
    "초기 대응",
    "증거 보존",
    "확산 방지",
    "복구 우선순위",
    "재발 방지대책",
    "휘발성 정보"
  ],
  "entities": [],
  "faq": [
    {
      "question": "사고 발생 시 시스템을 바로 재부팅해도 되나요?",
      "answer": "아니요, 증거 보존 전에 시스템을 재부팅하면 중요한 휘발성 정보가 사라질 수 있으므로 주의해야 합니다.",
      "evidence": [
        {
          "section_id": "sec-c64ff64ff1",
          "quote": "증거 보존 전에 무조건 시스템을 재부팅하면 중요한 휘발성 정보가 사라질 수 있다."
        }
      ]
    },
    {
      "question": "서비스가 복구되면 사고 대응이 종료된 것인가요?",
      "answer": "아니요, 서비스 복구만으로 사고를 종료하지 않으며 원인, 영향, 재발 방지대책 및 미해결 항목을 검토해야 합니다.",
      "evidence": [
        {
          "section_id": "sec-ed988a279c",
          "quote": "서비스 복구만으로 사고를 종료하지 않는다. 원인, 영향, 재발 방지대책 및 미해결 항목을 검토한다."
        }
      ]
    }
  ],
  "relations": []
}
